{
  "schema_version": "stage1-mvp-v0",
  "task_id": "docops_struct_simulate_json_001",
  "expected_runtime_status": "committed",
  "expected_task_success": true,
  "acceptance_checks": [
    "selector_resolution_matches",
    "simulated_source_hash_unchanged"
  ],
  "action_sequence": {
    "actions": [
      {
        "action_type": "simulate_structured_edit",
        "action_payload": {
          "path": "inputs/spec.json",
          "selector": {
            "type": "json_path",
            "path": "$.stage.domain"
          },
          "operation": "replace",
          "replacement": "Document Ops"
        }
      }
    ]
  }
}
