{
    "schema_version":  "stage1-mvp-v0",
    "task_id":  "docops_ps1_traceability_cross_doc_refs_001",
    "expected_runtime_status":  "committed",
    "expected_task_success":  true,
    "acceptance_checks":  [
                              "traceability_links_exact",
                              "read_only"
                          ],
    "action_sequence":  {
                            "actions":  [
                                            {
                                                "action_type":  "validate_artifact",
                                                "action_payload":  {
                                                                       "path":  "inputs/routing.md",
                                                                       "validation":  "traceability_links"
                                                                   }
                                            }
                                        ]
                        }
}
