{
    "schema_version":  "stage1-mvp-v0",
    "task_id":  "docops_ps1_terms_contract_inline_001",
    "expected_runtime_status":  "committed",
    "expected_task_success":  true,
    "acceptance_checks":  [
                              "contract_result_exact",
                              "read_only"
                          ],
    "action_sequence":  {
                            "actions":  [
                                            {
                                                "action_type":  "validate_document_contract",
                                                "action_payload":  {
                                                                       "path":  "inputs/terms.md",
                                                                       "inline_contract":  {
                                                                                               "required_text":  [
                                                                                                                     "Evidence Packet",
                                                                                                                     "Verifier Runtime"
                                                                                                                 ]
                                                                                           }
                                                                   }
                                            }
                                        ]
                        }
}
